<?xml version="1.0" encoding="utf-8"?>
<xs:schema attributeFormDefault="unqualified" elementFormDefault="qualified" xmlns:xs="http://www.w3.org/2001/XMLSchema">

  <xs:element name="comanda" type="tipusComanda"/>

  <xs:complexType name="tipusComanda">
    <xs:sequence>
      <xs:element name="codiProveidor" type="xs:string"/>
      <xs:element name="data" type="xs:string"/><!--Ficar tipus date-->
      <xs:element name="articles" type="tipusArticles"/>
    </xs:sequence>
  </xs:complexType>

  <xs:complexType name="tipusArticles">
    <xs:sequence>
      <xs:element name="article" type="tipusArticle"  minOccurs="0" maxOccurs="unbounded"/>
    </xs:sequence>
  </xs:complexType>
  
  <xs:complexType name="tipusArticle">
    <xs:sequence>
      <xs:element name="codiArticle" type="xs:string"/>
      <xs:element name="quantitat" type="xs:string"/>
      <xs:element name="preu" type="xs:string"/>
      <xs:element name="rebut" type="xs:string"/>
    </xs:sequence>
  </xs:complexType>
</xs:schema>
