<?xml version="1.0" encoding="utf-8"?>
<comanda xmlns:xsi="http://www.w3.org/2001/XMLSchema-instance" xsi:noNamespaceSchemaLocation="comandes.xsd">
    <codiProveidor>P03</codiProveidor>
    <data>2015-09-24</data><!--Ha de estar amb aquest format: 2002-09-24 -->
    <articles>
        <article>
            <codiArticle>0001</codiArticle>
            <quantitat>8</quantitat>
            <preu>20</preu>
            <rebut>No</rebut>
        </article>
        <article>
            <codiArticle>0003</codiArticle>
            <quantitat>12</quantitat>
            <preu>25</preu>
            <rebut>No</rebut>
        </article>
        <article>
            <codiArticle>0005</codiArticle>
            <quantitat>5</quantitat>
            <preu>7</preu>
            <rebut>No</rebut>
        </article>
        <article>
            <codiArticle>0007</codiArticle>
            <quantitat>10</quantitat>
            <preu>40</preu>
            <rebut>No</rebut>
        </article>
        <article>
            <codiArticle>0009</codiArticle>
            <quantitat>17</quantitat>
            <preu>12</preu>
            <rebut>No</rebut>
        </article>
        <article>
            <codiArticle>0011</codiArticle>
            <quantitat>14</quantitat>
            <preu>11</preu>
            <rebut>No</rebut>
        </article>
        <article>
            <codiArticle>0013</codiArticle>
            <quantitat>16</quantitat>
            <preu>12</preu>
            <rebut>No</rebut>
        </article>
        <article>
            <codiArticle>0015</codiArticle>
            <quantitat>5</quantitat>
            <preu>32</preu>
            <rebut>No</rebut>
        </article>
    </articles>
</comanda>